{
  "run_id": "FLT-PHP-01-20260718-001",
  "unit_id": "PHP-01-019-026",
  "role": "balanced_worker",
  "attempt": 1,
  "status": "complete",
  "input_packet_sha256": "6341bf3f87009846656f472deff6e826352f33816d97bf0dc84440f8305e56fb",
  "output": {
    "proposed_rendering": "I know that my distress will become my deliverance through your prayers and the generous help of the Spirit of Jesus Christ. I eagerly expect and hope that I will have no reason to be ashamed. Instead, I will face this with complete courage so that Christ will be honored through me, whether I live or die.\n\nFor me, living is Christ, and dying is gain. If I go on living, I can continue doing fruitful work. I do not know which I would prefer. I am pulled in both directions. I long to leave this life and be with Christ, which is far better. But remaining alive is more necessary for your sake.\n\nSince I am convinced of this, I know that I will remain and continue with all of you for your progress and joy as you trust Christ. Then, when I am with you again, you will have even more reason to rejoice in Christ Jesus because of me.",
    "paragraphing": "preserved as supplied",
    "possible_sense_selections": [],
    "significant_meanings_expressed": [],
    "dynamic_restructuring": [],
    "clarifications_made": [],
    "meaningful_forms_preserved_or_recreated": [],
    "possible_meaning_loss": [],
    "possible_added_meaning": [],
    "possible_too_loose_risks": [],
    "possible_too_literal_risks": [],
    "oral_flow_concerns": [],
    "footnote_candidates": [],
    "uncertainties": [],
    "human_only_questions": []
  },
  "self_finalization_claim": false,
  "created_at": "2026-07-18T00:00:00Z",
  "warnings": [
    "Single-model role-isolation simulation only; not proof of independent model convergence."
  ],
  "human_only_questions": [],
  "raw_output_path": "outputs/PHP-01-019-026_balanced_worker_output.json"
}