{
  "run_id": "FLT-PHP-01-20260718-001",
  "unit_id": "PHP-01-019-026",
  "role": "greek_fidelity_worker",
  "attempt": 1,
  "status": "complete",
  "input_packet_sha256": "6915a5a6ab7780df6b16186c116aa211b8feed7b8cce4a55cdd8814b39ba435d",
  "output": {
    "proposed_rendering": "For I know that this will turn out for my deliverance through your prayer and the provision of the Spirit of Jesus Christ, according to my eager expectation and hope that in nothing I will be put to shame. Instead, with all boldness, now as always, Christ will be magnified in my body, whether through life or through death.\n\nFor to me, to live is Christ and to die is gain. But if I am to live in the flesh, this means fruitful work for me, and I do not know what I will choose. I am hard pressed between the two: I have the desire to depart and be with Christ, for that is far better, but to remain in the flesh is more necessary for your sake.\n\nConvinced of this, I know that I will remain and continue with all of you for your progress and joy in the faith, so that your reason for boasting in Christ Jesus may overflow because of me when I come to you again.",
    "paragraphing": "preserved as supplied",
    "possible_sense_selections": [],
    "significant_meanings_expressed": [],
    "dynamic_restructuring": [],
    "clarifications_made": [],
    "meaningful_forms_preserved_or_recreated": [],
    "possible_meaning_loss": [],
    "possible_added_meaning": [],
    "possible_too_loose_risks": [],
    "possible_too_literal_risks": [],
    "oral_flow_concerns": [],
    "footnote_candidates": [],
    "uncertainties": [],
    "human_only_questions": []
  },
  "self_finalization_claim": false,
  "created_at": "2026-07-18T00:00:00Z",
  "warnings": [
    "Single-model role-isolation simulation only; not proof of independent model convergence."
  ],
  "human_only_questions": [],
  "raw_output_path": "outputs/PHP-01-019-026_greek_fidelity_worker_output.json"
}