{
  "run_id": "FLT-PHP-01-20260718-001",
  "unit_id": "PHP-01-003-011",
  "role": "greek_fidelity_worker",
  "attempt": 1,
  "status": "complete",
  "input_packet_sha256": "9e40af2681a5deb56bf2f4dabf7d00d2f74b86fb1a41762a49276e35522693cd",
  "output": {
    "proposed_rendering": "I thank my God in every remembrance of you, always making my prayer for all of you with joy, because of your partnership in the good news from the first day until now. I am confident of this very thing: the One who began a good work among you will bring it to completion by the day of Christ Jesus.\n\nIt is right for me to think this way about all of you because I have you in my heart. All of you share with me in grace, both in my imprisonment and in the defense and confirmation of the good news. God is my witness that I long for all of you with the deep affection of Christ Jesus.\n\nAnd this I pray: that your love may grow still more in knowledge and every kind of discernment, so that you may test and approve what truly matters and be sincere and blameless for the day of Christ, filled with the fruit of righteousness that comes through Jesus Christ, to the glory and praise of God.",
    "paragraphing": "preserved as supplied",
    "possible_sense_selections": [],
    "significant_meanings_expressed": [],
    "dynamic_restructuring": [],
    "clarifications_made": [],
    "meaningful_forms_preserved_or_recreated": [],
    "possible_meaning_loss": [],
    "possible_added_meaning": [],
    "possible_too_loose_risks": [],
    "possible_too_literal_risks": [],
    "oral_flow_concerns": [],
    "footnote_candidates": [],
    "uncertainties": [],
    "human_only_questions": []
  },
  "self_finalization_claim": false,
  "created_at": "2026-07-18T00:00:00Z",
  "warnings": [
    "Single-model role-isolation simulation only; not proof of independent model convergence."
  ],
  "human_only_questions": [],
  "raw_output_path": "outputs/PHP-01-003-011_greek_fidelity_worker_output.json"
}