{
  "run_id": "FLT-PHP-01-20260718-001",
  "unit_id": "PHP-01-012-018",
  "role": "readability_worker",
  "attempt": 1,
  "status": "complete",
  "input_packet_sha256": "4c59ca1cc7a34e5ddd8daa04a556b4ba294798df51c1ae8ae1ecbe3339b9f3df",
  "output": {
    "proposed_rendering": "Brothers and sisters, I want you to know that what has happened to me has actually helped the good news move forward. Everyone in the imperial guard, along with everyone else, now knows that I am in prison because I belong to Christ. My imprisonment has made most of the believers more confident in the Lord, and they now speak God’s message with greater courage and without fear.\n\nSome preach Christ because they are jealous and want to compete with me, while others do it from good motives. Those who act out of love know that I am here to defend the good news. The others preach Christ from selfish ambition and not from sincere motives. They think they can make my imprisonment even harder. But what really matters is that Christ is being proclaimed, whether the motives are false or sincere. That is why I rejoice and will continue to rejoice!",
    "paragraphing": "preserved as supplied",
    "possible_sense_selections": [],
    "significant_meanings_expressed": [],
    "dynamic_restructuring": [],
    "clarifications_made": [],
    "meaningful_forms_preserved_or_recreated": [],
    "possible_meaning_loss": [],
    "possible_added_meaning": [],
    "possible_too_loose_risks": [],
    "possible_too_literal_risks": [],
    "oral_flow_concerns": [],
    "footnote_candidates": [],
    "uncertainties": [],
    "human_only_questions": []
  },
  "self_finalization_claim": false,
  "created_at": "2026-07-18T00:00:00Z",
  "warnings": [
    "Single-model role-isolation simulation only; not proof of independent model convergence."
  ],
  "human_only_questions": [],
  "raw_output_path": "outputs/PHP-01-012-018_readability_worker_output.json"
}