{
  "run_id": "FLT-PHP-01-20260718-001",
  "unit_id": "PHP-01-012-018",
  "role": "balanced_worker",
  "attempt": 1,
  "status": "complete",
  "input_packet_sha256": "896e12770915a16a4fc9c29b9d9b675115967256683fde7c807b27c33a8968c7",
  "output": {
    "proposed_rendering": "I want all of you to know, brothers and sisters, that my imprisonment has actually helped the good news move forward. Everyone in the imperial guard, along with the others here, now knows that I am imprisoned because of Christ. Being in prison has made most of the believers here more confident in the Lord. They are more daring to speak God’s message without fear.\n\nSome proclaim Christ out of envy and rivalry, while others do it with good intentions. Those who act out of love know that I am here to defend the good news. But the others proclaim Christ from selfish ambition rather than sincere motives. They think they can add to my suffering while I am in prison. What really matters is that Christ is being proclaimed, whether people speak with false motives or sincere ones. That is why I rejoice and continue to rejoice!",
    "paragraphing": "preserved as supplied",
    "possible_sense_selections": [],
    "significant_meanings_expressed": [],
    "dynamic_restructuring": [],
    "clarifications_made": [],
    "meaningful_forms_preserved_or_recreated": [],
    "possible_meaning_loss": [],
    "possible_added_meaning": [],
    "possible_too_loose_risks": [],
    "possible_too_literal_risks": [],
    "oral_flow_concerns": [],
    "footnote_candidates": [],
    "uncertainties": [],
    "human_only_questions": []
  },
  "self_finalization_claim": false,
  "created_at": "2026-07-18T00:00:00Z",
  "warnings": [
    "Single-model role-isolation simulation only; not proof of independent model convergence."
  ],
  "human_only_questions": [],
  "raw_output_path": "outputs/PHP-01-012-018_balanced_worker_output.json"
}