{
  "run_id": "FLT-PHP-01-20260718-001",
  "unit_id": "PHP-01-012-018",
  "role": "greek_fidelity_worker",
  "attempt": 1,
  "status": "complete",
  "input_packet_sha256": "c0e8103ee2c3b53a8f46b7e3959b4182612d37a2e9dd7f9c7110e603869adee5",
  "output": {
    "proposed_rendering": "I want you to know, brothers and sisters, that the things concerning me have turned out rather for the advance of the good news. As a result, it has become clear throughout the whole imperial guard and to everyone else that my imprisonment is in Christ. Most of the brothers and sisters, having become confident in the Lord because of my imprisonment, dare even more to speak the word without fear.\n\nSome proclaim Christ because of envy and rivalry, but others from goodwill. The latter do so from love, knowing that I am appointed for the defense of the good news. The former proclaim Christ from selfish ambition, not sincerely, thinking to stir up trouble for me in my imprisonment. What then? Only this: in every way, whether from false motives or in truth, Christ is proclaimed, and in this I rejoice. Yes, and I will continue to rejoice.",
    "paragraphing": "preserved as supplied",
    "possible_sense_selections": [],
    "significant_meanings_expressed": [],
    "dynamic_restructuring": [],
    "clarifications_made": [],
    "meaningful_forms_preserved_or_recreated": [],
    "possible_meaning_loss": [],
    "possible_added_meaning": [],
    "possible_too_loose_risks": [],
    "possible_too_literal_risks": [],
    "oral_flow_concerns": [],
    "footnote_candidates": [],
    "uncertainties": [],
    "human_only_questions": []
  },
  "self_finalization_claim": false,
  "created_at": "2026-07-18T00:00:00Z",
  "warnings": [
    "Single-model role-isolation simulation only; not proof of independent model convergence."
  ],
  "human_only_questions": [],
  "raw_output_path": "outputs/PHP-01-012-018_greek_fidelity_worker_output.json"
}