{
  "run_id": "FLT-PHP-01-20260718-001",
  "unit_id": "PHP-01-001-002",
  "role": "greek_fidelity_worker",
  "attempt": 1,
  "status": "complete",
  "input_packet_sha256": "04e37d042794d9282d159ff7c3ae527a3f1dec09ab2d53a1b5eed5e97ea62906",
  "output": {
    "proposed_rendering": "Paul and Timothy, servants of Christ Jesus,\n\nto all the holy people in Christ Jesus who are in Philippi, together with the leaders and assistants:\n\nGrace to you and peace from God our Father and the Lord Jesus Christ.",
    "paragraphing": "preserved as supplied",
    "possible_sense_selections": [],
    "significant_meanings_expressed": [],
    "dynamic_restructuring": [],
    "clarifications_made": [],
    "meaningful_forms_preserved_or_recreated": [],
    "possible_meaning_loss": [],
    "possible_added_meaning": [],
    "possible_too_loose_risks": [],
    "possible_too_literal_risks": [],
    "oral_flow_concerns": [],
    "footnote_candidates": [],
    "uncertainties": [],
    "human_only_questions": []
  },
  "self_finalization_claim": false,
  "created_at": "2026-07-18T00:00:00Z",
  "warnings": [
    "Single-model role-isolation simulation only; not proof of independent model convergence."
  ],
  "human_only_questions": [],
  "raw_output_path": "outputs/PHP-01-001-002_greek_fidelity_worker_output.json"
}